,response,context
428,"If you like him, text him","I met a guy online, we talked for a few weeks and we went on a date two weeks ago. I felt there was mutual interest and he expressed how he wanted to see me again but plans kept falling through. We haven’t talked in a week now. Should I text him saying hey and ask him if he would like to hang out this week?"
430,"Go for it, the worst thing that happens is you don’t chat with him again which is where you’re already at",Haven’t talked to him in a week. Thinking of texting him asking to hang out
432,"Yes, people have gone through this before","Fell in love with this girl, but she kept sending mixed messages so decided to end things and now she's blocked me from everything."
433,Thank you for the advice,"Yes, people have gone through this before"
434,It makes it easier from me to wipe them from my life,"I told her we can't be friends because I love her and want a committed relationship, and now she's blocked me from everything."
436,Sounds like a massive jump to cheating,"! just genuinely curious if anyone can think of a reasonable explanation as to why my bf’s switch control button would be in the corner of a lewd video he sent to me, and if it’s worth asking him about after so much time has passed since? any advice is greatly appreciated thank you!"
438,"Well, you can always just ask",should i be concerned?
440,It's waaaaay too early for you to have any expectations on this man's life at all,I feel as though I'm not important to him.
441,Why do you think I don't have a right to be a priority in his life?,It's waaaaay too early for you to have any expectations on this man's life at all
442,"Perhaps by trying to be objective in helping him make the decision, you’ve given him the impression that you don’t have a strong preference",Commitment
444,Sounds like you two are not really compatible,mean?
445,thank you,Sounds like you two are not really compatible
448,"I think it means you're hung up on someone who does not want to be with you, but because he's your friend you are holding on to false hope (for now)",Does having an emotional breakdown the night before a first date mean I'm not ready to move on quite yet??
450,1,I  am terrified to go on a first date tomorrow
452,What if that break make a new problem and make you even more depressed? Consider that first,Been depressed lately and don't know to tell my boyfriend
454,Just straight up tell him how you are feeling,How do I  tell my boyfriend  I'm depressed and need a break from everything?
456,"jesus, is she always like this? i’d be very hurt honestly",savage girlfriend doesn’t want me to visit her after her 4 week holiday.
457,I was so confused and hurt,"jesus, is she always like this? i’d be very hurt honestly"
458,[removed],How would you feel if
459,I thought that too,[removed]
460,"First off, don’t mentally diagnose people with things like personality disorders","My partner seems empty and distant sometimes. He says he loves me, but I'm afraid it's no more than desire and he just likes my body, but not my personality. I want to find out if I'm wrong or right and he's not really interested in me."
462,I would ask him what he means by attached to you as a woman but not as a friend,I  think I might be dating a person  with avoidant personally disorder
463,"Yup, came here to say exactly this",I would ask him what he means by attached to you as a woman but not as a friend
464,You are gonna need to trust her if the relationship will work at all esp at long distance,Girlfriend is going out with a man on solo dates after leaving for another country due to her job
466,Dude………wtf,Long distance relationship: Girlfriend [25] is going on solo dates with a man she met a few days ago
468,"It is quite weird for someone to touch you as you’re passed out, it seems very violating to me",I’m concerned if a situation that happened between me and my friends s.o. was inappropriate/weird/wrong.
476,"You could try find like minded people? For example if you are into gaming find some online forums? Same goes for any hobbies, you can look up classes or events near you based on what you like",most of the friends I pick turn out to be bad people. How can I avoid making bad friends?
480,"A few things, first of all, are you still interested in joining the military? Because you could too","harboring resentment for long term partner of 7 years for joining military while warning me against it. Also upset that after all these years, joining the military happened before they even thought about proposing to me. Don’t care how I come across, I’m annoyed."
481,"As far as joining myself, I’m not so interested that I want to join right this second","A few things, first of all, are you still interested in joining the military? Because you could too"
482,How long ago did they tell you not to do it? If it was a couple years ago there’s a big chance his opinion changed on the military,I resent my long term partner for joining the military
483,"Yea it was like a couple years back when he initially said that 

I did verbalize how I felt, they said sorry and then that was kind of it",How long ago did they tell you not to do it? If it was a couple years ago there’s a big chance his opinion changed on the military
484,"Here are some tools to keep in your back pocket when this comes up again:

1",am I just being a stupid teen for not accepting advice from my parents even if the advice is really bad. And is it normal for people to get angry at you for having reasons that the advice won't work.
486,It sounds like you need to stop asking your parents for advice unless you're absolutely sure you want to hear what they have to say,Is it normal to have to pander to people giving advice?
488,"I have never understood this ""break"" concept",Is he being childish and what should I do with the situation? Wait for him or move on?
489,"thank you!

this is also how i feel","I have never understood this ""break"" concept"
490,"You've been together *6 years* and he decided blindside you by telling you he wants a break VIA TEXT? and doesn't want to talk about it in person?! Did you guys even lay out ground rules for the ""break""? Discuss seeing other people during this time? I hate to say it, but just with the way he went about this, it seems like this is just delaying an inevitable breakup","My boyfriend 24 of six years wants a break, I don't know what to do."
491,IKNOW its weird right? Like 6 years we have been together and he cannot call me or tell me in my face,"You've been together *6 years* and he decided blindside you by telling you he wants a break VIA TEXT? and doesn't want to talk about it in person?! Did you guys even lay out ground rules for the ""break""? Discuss seeing other people during this time? I hate to say it, but just with the way he went about this, it seems like this is just delaying an inevitable breakup"
492,What did your sister say when you talked to her about it?,"interested in my sister's friend/roomate, but worried about things becoming awkward if it goes bad."
493,I haven't yet,What did your sister say when you talked to her about it?
496,I'm sorry you've had those experiences,"\*\* : So I have low confidence in terms of guys. I feel afraid that if I date a guy, I might end up causing pain to them. I am sort of clumsy, dumb and fat. Any tips?"
497,"Yeah, I have started aerobics and focusing on myself now",I'm sorry you've had those experiences
498,Meeting people through shared hobbies is great advice (as it helps you meet like minded people while also giving you something you personally enjoy and can use to enrich your life as a single person),I  want to date guys when everything becomes offline. But I am not confident and feel weird.
499,This is sooo well written and true,Meeting people through shared hobbies is great advice (as it helps you meet like minded people while also giving you something you personally enjoy and can use to enrich your life as a single person)
500,"I probably wouldn't visit, because I wouldn't expect that to go well, given the way they have been behaving",- Should I visit my Jehovah’s Witness family who have been shunning me just to let them know that I love them?
502,Will it make life more difficult for them if you visit,"Should I , pay my Jehovah’s Witness family a visit two months after I have disassociated and left?"
504,Look up the grey rock method,I detest the fact that my sister gets away with all her mean spirited actions and I am made out to be the villain every single time. My non-existent career is a reason I haven't left home yet.
505,Thanks a lot for responding,Look up the grey rock method
506,i would get away from people who make you feel this way,"My sister is a narcissistic , gaslighting pathological liar with a puppet for a husband. I am sick of bearing the brunt of her lies because I am to safeguard her honor because she is married all the while she is allowed to trample over mine!"
507,That's the plan :),i would get away from people who make you feel this way
508,The first thing I would do is to put more effort into making your relationship with M fun and exciting,I have a crush on my best friend but I am in a relationship already.**
509,"Weekends are dedicated to ourselves, the only reason I was hanging out with ""B"" yesterday night was because ""M"" has covid right now and we are not supposed to see eachother until wednesday",The first thing I would do is to put more effort into making your relationship with M fun and exciting
510,"Honestly it sounds like you’re panicking at serious commitment to one person at a really young age, like it’s almost too good to be true",I  have a wonderful girlfriend  which is why it hurts me so much to be so obesessed over my best friend
512,No one from any Scandinavian country is going to be offended by your jewelry,"I wanted to buy some ""Viking"" jewelry and my friend thinks it's racist."
514,Sounds kind of salty you turned him down,My friend hates my jewelry. I don't know what to think.
515,"Thanks, I appreciate getting an additional perspective",Sounds kind of salty you turned him down
516,Nope not paranoid that guy is sketch level 100,"I think my Mom's friend seems to have romantic interest in her, and he wants to put us in a position of being dependent on him financially and for shelter."
518,Definitely not paranoid or cintric,I  and worried about a friend  of my mother  who has been offering her a lot of way-too generous help.
520,"When you're out tomorrow, just make an effort to get to know her better",I want to ask a girl out but we only ever interact with each other in group settings. What should I do?
524,"I don’t think you’re an asshole, you just aren’t ready for a relationship yet even though you sometimes want one",": why can't I just get into a relationship? Im in this never ending cycle of talking to a girl, but then getting bored and dropping it after a while. I feel like an asshole when I do it, and I really want to get into a relationship, but then I don't after a while."
525,Thank you for the advice,"I don’t think you’re an asshole, you just aren’t ready for a relationship yet even though you sometimes want one"
526,do you meet the girls?,Am I an asshole?
527,Yeah,do you meet the girls?
528,"God, stop with the on again off again",My boyfriend of almost 3 years is refusing to re-home his aggressive cat that I’m severely allergic to.
529,"Seriously, on again off again is reason enough to end it","God, stop with the on again off again"
530,Why are you living with him when you know he got the cat while you two were no longer dating? Why are you subjecting your son to whom you're supposed to be protecting and yourself to allergies and harm from an animal when it is within your power to prevent it? You chose to get back with this man and to move into his home or at the very least stay in his home multiple days a week when you knew he bought a cat,Reached my limit with boyfriends cat
531,Whew! This is the one! I feel little sympathy for a grown adult who has the options to just… not accept their current circumstances,Why are you living with him when you know he got the cat while you two were no longer dating? Why are you subjecting your son to whom you're supposed to be protecting and yourself to allergies and harm from an animal when it is within your power to prevent it? You chose to get back with this man and to move into his home or at the very least stay in his home multiple days a week when you knew he bought a cat
532,It's natural to be curious about the people in your family,I tried to guess one of my cousin’s sexuality and told my other close cousin who I now realize might be in the closet. I feel weird about it and how it might’ve created a rift in our relationship.
534,It's okay to be curious! But please don't ask her any questions about it or make it seem like you're trying to make her come out to you,Am I weird for trying to guess someone’s sexuality? Advice pls.
536,"Sounds like your getting caught up on the concept of ""missing out""

The idea that it's your only chance to be single and explore relationships is a possibly a misplaced one, your probably not missing as much as you may think and there's plenty of time for that further down the line that's what you want to be doing","in college been in relationship for 2 years, love him but there are many things about him that make me realize I wouldn’t marry him, not sure if it’s fair to both of us to continue till the end of college."
538,Make a decision,"College relationship, unsure what to do"
540,>This relationship has turned toxic and I just want to save it,"boyfriend with extreme trust issues refuses to build trust with me based off past relationships. He constantly believes I am cheating on him, talking to other men, am up to no good when I have never been unloyal to him OR any other man in my life previously. I’ve done everything he has asked of me to help build trust, yet nothing has changed."
541,As someone who went through this with my ex,>This relationship has turned toxic and I just want to save it
542,>he has been lied to and cheated on and extremely hurt,my bf  still refuses to trust me  after almost a year of dating
544,It sounds like you are setting yourself up for failure,: I need to know whether this situation is worth pursuing
545,"hey, you are probably right",It sounds like you are setting yourself up for failure
546,"If you know you won't be able to keep this up without catching feelings, I'd end it sooner rather than later",The person I am seeing doesn’t want a relationship.
548,This was horrifying to read,"Despite all efforts to clarify to my partner that I have a sex drive and a healthy sexual relationship is one of the most important aspects of a relationship to me, my partner does not care to fulfill those needs no matter how simple I make it for them, even after they promise consistency in some form."
549,I am kind to them and it took months of them not touching me for me to even vocalize that I was unhappy,This was horrifying to read
550,You and your partner are sexually incompatible,How do I deal with a lack of sexual validation in my relationship?
552,I would actually take the time to thank the person who sent me the video and ask about their relationship with him,"boyfriend is clearly looking elsewhere, how do I leave things?"
554,I don’t have words to describe how despicable I find your soon to be ex,I  was sent an obviously recent nurse video of my boyfriend  from a random girl on the book of faces
556,Do you think your family is even going to be receptive of you considering you ran off?,- About eight months ago I took off from my parents and I might be needing their help soon now even though I am much happier away
557,"I don’t know… 

I hope so",Do you think your family is even going to be receptive of you considering you ran off?
558,"What sort of help are you wanting from them? Financial? Logistical? Housing? Is your current situation stable? How can you trust that if you put yourself in a position to rely on them (like living with them, counting on them for childcare, whatever), that they will treat you better than they did before? What happens if you put yourself and your baby in a position to be dependent upon their assistance, and then you're trapped in a bad situation? Like if you quit your current job to move back to your parents' house, and then you have no income of your own, and no ""escape"" plan, because you can't afford to move out?

I think it would be better to slowly open the lines of communication, work on building a new relationship with them, but don't ask for help or rely on them until you establish a new history together of trust, mutual respect, and good treatment of each other",About eight months ago I took off from my parents and I might be needing their help soon now even though I am much happier away
560,"I would not bet on this lasting forever, so do whatever you want",bf says he loves me back but then had a hard time saying it for a week and not sure if I should wait longer into the relationship to hear him say it to me first
562,Are you asking if you should stop telling him you love him until he says it on his own?,Will my bf ever be in love with me?
564,"If angry outbursts are our of character for him, my first thought is an early onset of dementia or similar",My father in law exploded at me for no reason and now refuse to talk to me.
565,">He has never done this before to me or in front of me, however my wife says he did this to her and her sister when they were gowning up","If angry outbursts are our of character for him, my first thought is an early onset of dementia or similar"
566,"If you want him to understand his behavior was unacceptable, stop chasing after him begging him to give you an excuse to accept it",Father in law  is refusing to talk to me
567,Amen,"If you want him to understand his behavior was unacceptable, stop chasing after him begging him to give you an excuse to accept it"
568,No that's not normal,fiancé and I haven’t gotten along in months.
569,"A couple months after living in an apartment together is when little fights started happening, and they’ve just gotten worse and worse",No that's not normal
570,"No, that’s not normal at all",My fiancé and I haven’t gotten along in months. Is this normal sometimes…or is our relationship dead.
572,You’re overthinking this one,is it normal for s/o to keep pictures of exes in social media?
574,I wouldn’t worry - sometimes people like to keep the pictures for the memory,My  girlfriend  keeps pictures of her exes on her social media. Is that normal?
576,At a certain point he's got to figure out how to handle himself when he's got nothing to do,my boyfriend is working on not drinking anymore and now he’s bored with no hobbies to do at home and I don’t know if I’m responsible for helping him find things to do.
578,He has to find his own thing,I  feel personally responsible for my boyfriends  well being and happiness
580,"If being interested in art critique is something you need in a relationship, then you should break up","despite engaging in his hobbies and passions, my boyfriend's engagement and interest in mine has progressively gone down in the last year (2 years together), even when I try to bring them forward to him. It has made me now less open about my passions and makes me hide them even more. He doesn't do this any of this on purpose though, I believe. What can I do?"
581,Art critique was just an example,"If being interested in art critique is something you need in a relationship, then you should break up"
582,"I think instead of hiding your other passions and hobbies, you should bring them forward",My  boyfriend  is showing less and less interest in my hobbies and passions even though I still engage with his. What can I do?
583,Hahaha probably he was burnt out as I would have an analysis or critique on average once every 2-3 weeks,"I think instead of hiding your other passions and hobbies, you should bring them forward"
584,I'm 35f and have plenty of guy friends,Is my bf being too friendly with his colleague? They have only known each other two months but talk everyday
585,This is great advice!,I'm 35f and have plenty of guy friends
586,“Work wife” and “work husband” are such cringy terms,Is my 28m BF having an emotional affair with his colleague of two months?
587,It’s enough of an ick that he should be dumped just for using the term,“Work wife” and “work husband” are such cringy terms
588,Sometimes it's hard for people when they are shy,"I’ve talked to my gf about my needs as far as compliments and initiating sex, but she isn’t meeting them and I’m tired of mentioning and scared that if I do anymore that it won’t mean anything because I had to say something first."
589,I give her compliments quite a bit,Sometimes it's hard for people when they are shy
590,"If you've spoken to her about it repeatedly, she been unwilling or unable to make changes, and you're still feeling unloved and unfulfilled in the relationship, perhaps its time to move on",Me  with my gf  of one year. She doesn’t give any compliments and I’m not sure what else to do about it.
591,I definitely don’t want to break up,"If you've spoken to her about it repeatedly, she been unwilling or unable to make changes, and you're still feeling unloved and unfulfilled in the relationship, perhaps its time to move on"
592,Either way your partner deserves to know,"Due to PTSD, I haven’t had sex with my boyfriend pretty much since the beginning of our relationship but I want to change it now."
596,Has she tried hypnosis?,"- sister has extreme anxiety, keeps my parents all night when she can't sleep, how do I help her?"
597,"No, she hasn't",Has she tried hypnosis?
598,"I have generalised anxiety and I’ve recently started magnesium L-threonate and it has definitely improved my sleep, anxiety and depression (that one usually coming from lack of sleep)",I  want to help my sister  deal with severe anxiety
600,You aren't unreasonable and I actually think your boyfriend is overstepping your boundaries,"bf is friends with someone I’m uncomfy with, and doesn’t listen to me when I say I don’t want them being friends"
601,"What about his boundaries? Perhaps he, you know, decides how he will interact with co-workers and conduct himself socially",You aren't unreasonable and I actually think your boyfriend is overstepping your boundaries
602,It’s unreasonable to tell people who they can and can’t talk to,My boyfriend is friends with someone I’m uncomfortable with.
604,Did you ask in what circumstances she might need that money in the future exactly? Tell her you'd be happy to lend again if she would need any money but right now you want your 2,"""My fiancee owes me money but she doesn't want to pay me, what's the best way to solve this situation?"""
606,I'd ask her if she ever intended to pay you back,My fiancee owes me money but she doesn't want to pay me.
608,"I mean she was clear that she wanted to take things slow and that’s what she is doing? If you want more, straight away she is not the girl for you, she isn’t ready or willing and that’s fine, it’s her choice and she warned you, don’t start getting annoyed",New girlfriend(26F) wants to meet me(26M) only once every two weeks.
609,Thanks a lot,"I mean she was clear that she wanted to take things slow and that’s what she is doing? If you want more, straight away she is not the girl for you, she isn’t ready or willing and that’s fine, it’s her choice and she warned you, don’t start getting annoyed"
612,First of all,basically I might have ruined something great with an amazing woman and am looking for advice and whether or not I have a chance. I am very serious about continuing therapy and working to better myself and regain her trust.
613,Well apparently i always looked suspicious on my phone because I would exit out of whatever app I was on when she'd come back from like the bathroom,First of all
616,I don't think it's an issue of you being jealous or insecure that he doesn't love you,"""Girl that used to like my bf stayed after everyone left, I felt excluded because they talked for three hours about topics I couldn't talk about, I felt angry, and now I'm confused"""
617,Thank you for your answer! I feel like my feelings and thoughts make more sense now,I don't think it's an issue of you being jealous or insecure that he doesn't love you
620,"Bruh, if you got perp walked out, yeah, it's over","Not sure where my heads are after this breakup, putting her on a pedestal and blaming myself for everything. Just need some sound advice"
621,We lived together there,"Bruh, if you got perp walked out, yeah, it's over"
622,"It doesn’t matter if you were using your old place as storage, because that literally means that you were living with her","Recently broken up, depression kicking in hard and need an outside POV"
623,I completely understand,"It doesn’t matter if you were using your old place as storage, because that literally means that you were living with her"
624,He’s using you as a safety net in case it doesn’t work out with this girl,my ex has a new girls friend but is still messaging me
625,Makes me wonder if he did this while we were together,He’s using you as a safety net in case it doesn’t work out with this girl
628,"Tell him “I don’t care what timeline you have, I’m excited for our future together and I’m in no rush","My mum told me that I have to get married by the end of this year at the latest. Should I let my boyfriend know what she's been saying (to give him a heads up, in case she tries to pressure him directly) or would telling him cause more tension and stress?"
