,response,context
234,"What are you getting out of this relationship that makes all of his immature behavior worth your while?

He's 29 years old; it's not as if he's a foolish teen who will grow out of things like road-rage-that-he-pretends-is-not-road-rage",I don’t know if I  should dump my  bf
236,"Just because you care about someone deeply and love them, it doesn't mean you have to be together","Girlfriend has slowly lost feelings for me and didn't tell me and I feel used and I can't accept her reasoning to face, and have a hard time remaining as friends while I really need her friendship. Thank you for reading"
237,"I really appreciate the insight, and especially the example on the end","Just because you care about someone deeply and love them, it doesn't mean you have to be together"
240,"I dunno maybe you’re not in love anymore?
After birth control made me slightly sad all the time I stopped taking it, you should try maybe seeing if that could change your mood",will suddenly loose feelings for boyfriend even though there’s nothing wrong. I want to do something to fix this.
242,I LOVE my  boyfriend with all of my heart,My emotions about my boyfriend aren’t making any sense.
252,You’re pretty young,"I have no clue who his ex is (as in, I don't know her personally, she's not a mutual friend, etc.), I am not jealous of her (besides the fact that I guess she dated him before me? I really don't know...). But I constantly find myself thinking about their relationship and how he may have felt with her. My friends tell me to remember that I have had previous relationships as well, and that does help, but I still find myself looking her up and stuff. I just want to know how to stop thinking about things like that, and how to stop looking her up on social media, etc."
253,"I have had other relationships that I have considered love, but this is definitely the most intense and healthiest one",You’re pretty young
254,>I even get upset when I think about something that we have done that I know they have also done,I  cannot stop thinking about my boyfriend's  ex
255,Very true,>I even get upset when I think about something that we have done that I know they have also done
256,> But I'm afraid no amount of time or effort can change what I did wrong,"used social media account to comment on thirst-traps 3 years ago. GF found it and it's caused problems since. We both view it as cheating, but is any amount of time and effort enough to get past this? Or will this always be a problem too hard to get over?"
257,That's what I'm afraid of yes,> But I'm afraid no amount of time or effort can change what I did wrong
258,Time isn't the factor here any longer,"My [28 M] GF [29 F] of 3 Years Resents Past Betrayal & Doesn't Know Whether to Trust me, or Break up With me."
259,"In her defense, I notice that she has made a bigger effort to avoid this subject when she's reminded of it",Time isn't the factor here any longer
260,\*\*Except,boyfriends guilt about how we met and got together eating at him as well as resentment. But our relationship is perfect in all other aspects. Are we doomed?
261,Thank you :),\*\*Except
262,>And talked badly about my current boyfriend to his bestfriend aka my exes brother,Does our relationship sound doomed?
263,"Indeed, very very hectic situation",>And talked badly about my current boyfriend to his bestfriend aka my exes brother
264,">she was aware when we first got together that I would like to move at some point, as it was a conversation had in the ""talking stage""

So what was her response?",I dont know how to speak to my girlfriend about a potentially relationship ending conversation.
265,"She just sort of acknowledged it, something along the lines of ""oh wow that sounds amazing"" - it was maybe a couple of weeks in to talking",">she was aware when we first got together that I would like to move at some point, as it was a conversation had in the ""talking stage""

So what was her response?"
266,Bring it up calmly,"I 27 would like to move home, whereas my girlfriend 26 isn't keen on the idea and I dont know how to talk about it. 10 month relationship."
268,"Sober him doesn’t seem interested in a relationship, and given how he’s backed off it seems like he realizes he let things get out of control when drunk him was directing the show","my guy best friend and I make out while we are drunk and the morning after while I am in his bed and we are both sober but then tells me he does not want a relationship, but doesn’t regret what happened and that he doesn’t causally kiss people. We agree when sober we should not kiss again but without fail every time we get drunk together things get heated and I sleep at his. I have caught feelings for him but dont think he feels the same. Does he? Should I tell him about how I feel?"
270,"He likely is just comfortable, but you don’t have to stop pursuing him if you don’t want to",My guy best friend  and I  kiss every time we get drunk but then agree to just be friends sober. What does this mean? Does he have feelings for me or am I just someone he feels comfortable around?
272,Move out,- my dad wants my paycheck. I have a feeling its to control me so i cant make my own decisions. My siblings dont give their paycheck to my dad.
274,Move,My dad wants my paycheck
276,"You can't tell her who to date, even if hes a terrible person","My best friend doesn't realize she's in a toxic relationship, and this could possibly ruin our friendship."
278,"There's a good show on netflix, Maid, about a verbally, emotionally abusive relationship and the woman struggling to make it on her own after her friends were all his and she had nothing to herself","My  best friend is in a toxic relationship with , and it could ruin our friendship"
280,Let's get this straight; your girlfriend was raped,: girlfriend had a relation. We got back together. But now I get anxious every time she does an activity without me
281,My ex did this then ghosted me five years later,Let's get this straight; your girlfriend was raped
282,"Anxiety is irrational, I suffer from it and get anxious things that bothered me in my last relationship even though my current one is amazing",Overcoming anxiety
283,“Be considered a rape” : On this point I feel really ashamed to have taken so long to come to this conclusion,"Anxiety is irrational, I suffer from it and get anxious things that bothered me in my last relationship even though my current one is amazing"
284,"> MIL said I can just get an elective c-section before the baby was late so they could see her before they left the country 

> they said they would just have to pray the baby arrives a few weeks early so they could see her before they leave 

Um, *what?!* What in the world are you doing tiptoeing through the tulips trying not to be disrespectful about a gift, and worrying about not upsetting the plans they made without your input or permission, when they’ve made it clear they prioritize their own wants and needs over the health of your baby?!

I’m just absolutely baffled at why you’d even humor this from them","- in laws will miss birth of our baby, should we leave them overnight with the 3mo baby to attend a concert they gifted us?"
286,Your husband needs to tell them no,In-Laws will miss birth of our child; want to keep our baby overnight at >3mo while we attend a concert they gifted us
287,>If she throws a tantrum it'll be great practice for when your baby is a toddler,Your husband needs to tell them no
288,">I am feeling a little guilty maybe it's my fault for not just doing what she wants

That's why 'the silent treatment' is usually such a manipulative tactic",Mom broke ties with me after I told her that I want freedom in my life.
290,So,Mom disowned me after I argued with her
291,Thanks for your reply,So
292,>It's starting to make me feel like I'm just another girl to him and not special,my boyfriend confuses events/things between myself and his exes.
293,I've thought about that too,>It's starting to make me feel like I'm just another girl to him and not special
294,He is either getting you mixed up with other people or possibly gaslighting you,Over thinker or real issues?
295,We did that for one of the issues,He is either getting you mixed up with other people or possibly gaslighting you
296,"Have you tired telling him all this? 

You want to be actual friends, not just political allies",- My best friend only talks about what is outraging him in politics and it's driving a wedge between us.
298,Part of my deradicalization effort was finding a place to volunteer,My [30M] best friend [30M] is constantly sharing and talking about politics with me and it makes me want to talk to him less.
300,"If there is no proof, no one else talking about it, etc, he’s most likely lying",BF won’t disclose reason for major operation. Should I be concerned or am I crossing a line?
301,This is what I’m worried about because I’ve caught and confronted him on a few lies before,"If there is no proof, no one else talking about it, etc, he’s most likely lying"
302,I see you’ve recently posted about your love life being ‘one hurt after another’ in an astrology sub,My BF won’t tell me why he’s having surgery
304,"If this was 3 year old relationship,  the normal advice would for you to find reasons why you love her emotionally & constantly remind yourself of that plus find out what is it about you psychological/mentally giving you hang up about her",": I am in a relationship with a great girl, but am not attracted to her sexually and physically"
306,">In the beginning, I had doubts about whether I found her physically and sexually attractive but I kept dating her anyway because I didn’t want to be shallow",I don’t find my girlfriend physically or sexually attractive anymore
307,Been on the other side of this story,">In the beginning, I had doubts about whether I found her physically and sexually attractive but I kept dating her anyway because I didn’t want to be shallow"
308,He has a set of behaviours you find unacceptable,Advice on how to overcome infidelity? Or at leas begin on attempting to move past it
310,Let me start off by saying that his behavior is completely unacceptable and that you really need to consider finding someone else,I want to move on but i dont know where to start
312,It's totally reasonable to be sexually incompatible,Guy I really like doesn’t like penetrative sex and I really do. How do I communicate to him that I need this to be sexually satisfied without pressuring him to do something he doesn’t want to do?
314,If it's something you need in a relationship and something he won't do at all then that's not going to work out and it's not anyone's fault,Guy  I’m  seeing doesn’t like penetrative sex
315,"I think it will be worth it to see why exactly he’s against it — is it a personal preference, is penetrative sex painful, are you just not physically able or willing to do it, etc",If it's something you need in a relationship and something he won't do at all then that's not going to work out and it's not anyone's fault
316,"It's okay for her to be upset, you don't need to try to fix it for her",GF wants to always be at my place. I need some space sometime. She feels rejected and hurt.
318,It's not your responsibility to turn YOUR home (that you are paying for) into her 14 hour/day work space just because it's more convenient for *her*,GF  wants to work full-time from my apartment. I  need some personal distance sometimes. She is hurt by this.
320,> For what it's worth I do have a therapist,I'm a boring suburban wife thinking about having a family but COVID has made me unenthusiastic**
321,Thank you for this response! Reading this made me realise I'm still clinging on to my childhood dreams of becoming an artist and travelling the world 'someday',> For what it's worth I do have a therapist
322,Before you give up and settle into a life of wanting and regret try doing something about it first,"I  am overwhelmed by a feeling of ""is this all there is"" with my husband"
323,The honeymoon still has to wait,Before you give up and settle into a life of wanting and regret try doing something about it first
324,Your needs matter too,": Boyfriend is depressed and escapes in video games. We spend a lot of time together physically but not what I consider quality time unless I ask for it. I tried helping him but he told me to ""just be there for him and give him space"". It's hard for me because it means putting my own needs aside."
325,"Thanks for your reply !

I actually struggle with depression too and after seeing a therapist and educating myself I figured out a bit about what I can do about this",Your needs matter too
326,"as a super depressed person I don't know how to go about this myself, but I just need to say your feelings and needs matter","My  boyfriend  is depressed, I don't know how to help and it's affecting our relationship"
328,"It sounds like two things are going on: she's not prioritising you, and she's interpreted what you said as ""you need to be better at compartmentalising your conversations"" rather than ""I don't feel like you're listening to me""",my friend seems to not be able to have an uninterrupted conversation with me about anything and is more interested in yelling at her dogs and talking to her fiancé.
329,I’m hoping we aren’t drifting apart,"It sounds like two things are going on: she's not prioritising you, and she's interpreted what you said as ""you need to be better at compartmentalising your conversations"" rather than ""I don't feel like you're listening to me"""
332,>Our love was so powerful and unique,":** Ex girlfriend pregnant during break up, trying to move on."
333,"Thank you for the words, I understand and it is a great reminder",>Our love was so powerful and unique
334,"If you don't want to raise a child and she decides to keep it then yes, obviously you have to let her go","Ex girlfriend gets pregnant during break up, time to let go"
335,"Yes, you're right, the relationship wasn't a waste of time, many happy memorable moments over the years","If you don't want to raise a child and she decides to keep it then yes, obviously you have to let her go"
336,This post has not left me with a positive impression of your bf,bf wants to hang w best friend alone that has been making advances w it and I don't know how to handle it without seeming controlling
338,Sounds like she’s the problem not you but your BF needs to be the one to set boundaries with her or it won’t matter,How can I help my bf and I deal w his best friend and her clinginess
339,"He said that he has, but I haven't seen them interact since that one day",Sounds like she’s the problem not you but your BF needs to be the one to set boundaries with her or it won’t matter
340,It's a gamble girl! Where you could get badly stuck or happy ever after! I would suggest think million times before taking arrange marriage step,Help me with what are the green flags and red flags in a normal social setup
341,Finding love doesn't seem to be a possibility right now tbh,It's a gamble girl! Where you could get badly stuck or happy ever after! I would suggest think million times before taking arrange marriage step
342,">How do you know he is being honest?

you dont",28F. Considering arranged marriage. How do you know he is the one?
343,Already blamed myself twice after getting cheated on,">How do you know he is being honest?

you dont"
344,"because he's married, would be my guess",! he appears and disappears. stops responding at bizarre intervals. I’m pretty sure he’s not making an effort to be consistent and is therefore not interested :/ but he sounds so sincere when he’s actually talking to me :/ what does it mean that he’s “emotionally confused”? What is this behavior?
345,I totally thought that at first,"because he's married, would be my guess"
346,">I feel detached from the situation enough to recognize that HE might be the one who isn’t acting right as opposed to me

You're absolutely right",Why does he vanish and reappear?
348,Just out of curiosity I looked through your post history,- my husband refuses to negotiate disagreements and takes it an extreme in one direction or the other.
349,Thanks for the feedback,Just out of curiosity I looked through your post history
350,Malicious compliance,Husband takes things to extremes when i try to communicate certain wants
351,I am sure there are a lot of people that could accuse me or that 😕,Malicious compliance
352,> She keeps telling me I'm so insecure,"my gf feels we don't have a same vibe anymore, I don't want her to feel hurt while telling me she loves me. How should I make her feel better?"
354,Have a talk about what happened and how it made you feel,My gf  feels something has changed after not being able to talk for a week.
355,I did,Have a talk about what happened and how it made you feel
356,So it sounds like you went out with friends and had some drinks and a good time while she was 900km away? Nothing wrong with that and she sounds like she's just jealous if I'm honest,! My 25M Gf 26F just left me in the restaurant alone and didn't contact for 2 days . She did it knowing I am insecure about this very thing.
358,You flew 900km to be with her and then proceeded to get drunk,My 25M Gf 26F just left me in the restaurant alone and didn't contact for 2 days . She did it knowing I am insecure about this very thing.
360,Well think of it like this,"! - Boyfriend takes hours to reply to texts and I begin to feel unwanted and not respected because of that. He also doesn't find it necessarily to get back to his family (mother, sister) in a decent amount of time, as he enjoys to live in the moment and doesn't like the feeling of being restricted of his freedom."
361,that helps to think a bit different!,Well think of it like this
362,"Why is him replying fast so important to you? I get that it's annyoing if he completely forgets to text back but what on earth does ""replying in a decent time"" even mean? He allready stated how he looks at his phone and I understand him well",Boyfriend  has a habit of replying late to the texts and it starts to annoy me
364,Im sorry youre going through all that,I told my best friend that I can’t be friends anymore because I love her. Covid took my chance of asking her out and she got back with her ex and still with him to this day. Can’t get over the thought of what could’ve been. How do I move on from this girl that I have never even been in a relationship with.
368,Have you told him how you feel about the picture thing? You should really talk to him about that first and see if he’s willing to stop? I I know some guys will probably say you’re overreacting but if you have past trauma with your previous relationships he should understand,I struggle with extremly jealousy for minor stuff and want to become better so it wont ruin my entire day everytime it happens.
370,But honestly just be confident with yourself that’s really important,"I struggle with extreme jealousy, and intrusive thoughts about my bf"
372,"Don’t add her back, it will be better for your mental health and help you move on",I was clingy towards my ex and she broke up with me. We’ve been apart for about 25 days. She blocked me on snap about 5 days ago but has now readded me. What should I do to get her back ignore it or accept it.
373,That is what I was thinking thanks so much for the advice,"Don’t add her back, it will be better for your mental health and help you move on"
376,">Like just for context my younger sister took her life recently, and I basically got on dating apps to take my mind off her

I dont think this is the best way to cope","great guy, wrong time (dealing with passing of younger sibling). don't know what to do, don't know how to break it to him"
377,Nope you are totally right,">Like just for context my younger sister took her life recently, and I basically got on dating apps to take my mind off her

I dont think this is the best way to cope"
378,I mean I dont think you need to do anything dramatic like break up or confess that you don't love him as much,perfect guy but not in the right place for a relationship and I don't know what to do
379,Okay,I mean I dont think you need to do anything dramatic like break up or confess that you don't love him as much
380,Sounds like you have a terrible therapist,"I want a friend to do activities with, I’m sick of doing things alone, but nobody wants to."
381,"Fully agreed, what the hell is that advice about?!",Sounds like you have a terrible therapist
382,">my therapist he tells me at my age I don’t have the right to have friends, to embrace solitude at middle age

You need a new therapist",I fear I’m going to wind up a lonely old cat lady.
384,"It doesn't really matter how he feels about her, fact is he lied and you can't trust him",! I dont know what to do? Do i leave him? Does he still love and miss her? He lied about everything the whole time.
386,Get a custody agreement for you child and end the relationship,Boyfriend  was talking to his ex our whole relationship  and lying about it.
388,"To be honest dude, you sound like a huge asshole","I like a girl, but she's too mature for her age, and idk if I should date her or not. I want to live my life but I also don't want her to be the one that got away."
390,You're not mature enough for a relationship with this person,I'm not sure if I should date this girl I like.
392,"One piece of advice that I can give to you, is don’t allow yourself to slip back into old habits either",I'm resentful of my boyfriend because I do 90% of the work. We're giving it one more chance after discussing expectations. Any advice?
393,Thank you that makes alot of sense,"One piece of advice that I can give to you, is don’t allow yourself to slip back into old habits either"
394,I think you covered it,Can I overcome resentment? 7 years near the end.
396,If you are still on taking terms with him maybe letting him know how you feel might give you a sense of closure,My ex sorta traumatized me and I feel like I cannot move past that trauma and I’m still holding on to it which makes me unwilling to trust other people. How long does it take to get over a relationship?
400,>She has a slight problem with alcohol,! Girlfriend cheated on me with her ex. There are many variables. Should I give her another chance?
401,Exactly,>She has a slight problem with alcohol
402,"Alright, let’s go over this as in depth as we can",My  girlfriend  of one year cheated on me with her ex. Should I take her back?
403,"I hope if the OP reads one thing today, it’s this","Alright, let’s go over this as in depth as we can"
404,I highly doubt you’ll regret cutting her off,Friend is invisible when I need her. Should I cut off or am I expecting too much?
406,"so it sould be asked, is there anything more than a friendship between you first and I personally would not continue a friendship where I have been the one to initiate all contact between us",Should I  cut off my close friend ?
407,"At some point, maybe but now we both have partners and don't see each other that way","so it sould be asked, is there anything more than a friendship between you first and I personally would not continue a friendship where I have been the one to initiate all contact between us"
408,"One way to ensure that you are not verging into toxic game-playing is to (instead of making it things that *he* has to strive for in order to ""win"" you) come up with challenges that you *both* have to work together to overcome in order to ""win"" each other",I want ideas of healthy ways of playing “hard to get in” in an established relationship.
410,A very literal interpretation of this (especially since Vday is coming up)-- set up a scavenger hunt that ends up at a table for two and you're sitting there waiting for him with a glass of wine :),Healthy ways to play hard to get within stable relationships
412,"You talked for a year and it was moving too fast? Tried to break up, didn't, then cheated on him",I cheated on my long distance boyfriend of 1 month and I fee horrible. I'm not sure how to go on living with myself
413,Well we were talking just as friends because we live in different cities,"You talked for a year and it was moving too fast? Tried to break up, didn't, then cheated on him"
414,"The number one step is to take responsibility for your actions, and by that I mean you need to talk to your boyfriend, apologize and break up properly","I  cheated on my  boyfriend, I know I'm horrible and I don't know how to continue on as myself"
416,You are not responsible for your exes emotions,ex still has feelings for me and i’m talking to someone else but don’t want to hurt him
418,"You're not a cheater, you're single",i don’t know how to navigate my love life
420,"It might be best to just block him, or send him a few sentences explaining why you can no longer be friends with him and unadd him","!:** friend (24M) who's been making me feel uncomfortable (through text messages and irl) doesn't respect my boundaries and I do not wish to continue the friendship. I'd like some advice or insights, if possible. Thank you for reading!"
421,It would definitely be a relief,"It might be best to just block him, or send him a few sentences explaining why you can no longer be friends with him and unadd him"
422,You say he “does not accept” certain things,My  friend  is making me feel uncomfortable
423,That's something I'm struggling with,You say he “does not accept” certain things
