,response,context
0,">What do I do?

What do you want him to do? Take you on dates? If so, what kind of dates? How often? Hug/kiss/compliment you? If so, how often?

What I'm poking at here is to use your words and *be specific",– Busy husband only ever wants to have sex during our limited time together.
1,"I like this comment, it is direct",">What do I do?

What do you want him to do? Take you on dates? If so, what kind of dates? How often? Hug/kiss/compliment you? If so, how often?

What I'm poking at here is to use your words and *be specific"
2,I'm a guy and had a girlfriend like this,My  husband  only ever wants to have sex…
4,She's openly flirting with women and getting their contact info while ignoring you,my girlfriend has previously hooked up with her roommate and I’m struggling to feel comfortable with their dynamic.
5,Also she might not be on the same page as you about what you need in a relationship,She's openly flirting with women and getting their contact info while ignoring you
6,There’s no difference in what is to be expected in a monogamous relationship,Bisexual gf was hooking up with her roommate
7,I'm sorry but if her roommate was a male this would be a 100% no fly zone,There’s no difference in what is to be expected in a monogamous relationship
8,No,"now that I have money, my father is demanding a lambo and 100k (infact that is what he was demanding me since I was a child), never helped me financially after 18 and affected my negatively mentally. Not sure what to say ."
9,he threatens to cut me off from family; Im the only one in the family member livinging and born in a western coutnry,No
10,Tell him no and stop telling him how much money you have,My 5X father demanding me 25M to purchase him a Lamborghini and give him 100k.
11,I second this,Tell him no and stop telling him how much money you have
12,Your two takeaways from this are correct,bf wants me to live with in laws indefinitely and will not support me if I ever want to leave.
13,Yeah that’s not a marriage,Your two takeaways from this are correct
14,Trust your gut,My bf wants me to live with his parents when we’re married.
15,And life with the parents that he won’t compromise on will be the first issue,Trust your gut
16,He told you he'd dump you for another woman,Summary: is there hope that he will come around and not do this again or should I send him and his collection of nudes to the curb?
17,Right?? I would frankly be way too embarrassed to stay at that point,He told you he'd dump you for another woman
18,Performance anxiety isn't an excuse for being unfaithful,Boyfriend  would rather Snapchat or use porn than be intimate. Says it’s not me it’s performance anxiety. I’m
20,The problem isn’t Tim and the parents,"My boyfriend's identical twin and their family had a rough start with me, but it isn't getting better. I decided for me personally that I want to see them less, but Pete, my boyfriend, won't go alone to visit them and I feel like a bad girlfriend."
21,"It sounds like the boyfriend is working on it, but that OP feels guilty",The problem isn’t Tim and the parents
22,You are asking questions to which there is no answer,I struggle to find a good way on how to deal with my boyfriends identical twin
24,"As someone who’s been sober for years now and has the same dental issues, if my partners friends said something about my smile I wouldn’t want to know","my friends made fun of my bf’s dental issues after being nice to his face. Not sure if I should tell him what they said, or spare his feelings, and if I should give my friends a chance to apologize."
25,Yea I didn’t realize how expensive it was,"As someone who’s been sober for years now and has the same dental issues, if my partners friends said something about my smile I wouldn’t want to know"
26,You seem to really care for this guy,My friends made fun of my boyfriend’s appearance.
27,Anyone who makes fun of another person's laugh or smile has a long way to go before they've matured,You seem to really care for this guy
28,"Well first of all, stop doing all the chores","I don’t know if my feelings are justified, he doesn’t want me moving out no matter what but I feel greedy saying I can’t afford it (I genuinely cannot). Is there anything else I need to consider? Please be honest"
30,"In this situation I wouldn't even hesitate, I'd move back home","Recently moved out F into a house boyfriend  owns, yet I pay half of mortgage making less than half of him. As doing all the chores"
32,"Are there local clubs for him to join, volunteer opportunties where he might be able to make more friends locally? Maybe he is feeling isolated after the move","bf of 5 years moved very far to be with me, and moved in with me. He hates his job and career and is constantly depressed. I don’t know how to help or improve our relationship."
33,Thanks so much! I’ll bring it up like this in a gentle way,"Are there local clubs for him to join, volunteer opportunties where he might be able to make more friends locally? Maybe he is feeling isolated after the move"
34,Honestly to me it sounds like he would prefer to just not work and have you provide for the both of you,Me  living with my bf  who moved very far and got a new job to be with me. He’s constantly depressed and I don’t know how to help
35,Yeah he’s paying his part and doing his fair share of housework and cooking,Honestly to me it sounds like he would prefer to just not work and have you provide for the both of you
36,">How would you have handled differently?

1",My father is constantly playing the victim about the most ridiculous things (ie. the size of a tv) and has now blocked me saying I’m toxic. What would you do?
38,You need to stop engaging,My father  blocked me  for calling him out
40,Guys who are almost 30 but dating 20 year olds aren't doing it because they're emotionally mature and well adjusted,"I have 'outgrown' him and the passion is gone, tips?"
42,"You can look at it two ways:

1","I  am not depending on him  anymore, passion is gone"
43,"Thanks for your reply! 
1","You can look at it two ways:

1"
44,I don't think this is good,on weekends I don't see my boyfriend he won't reply to my messages because we should be 'living our lives'
46,You’ve been together THREE YEARS and he knows this hurts you but does it anyway,Boyfriend only messages me weekdays if we don't have plans
48,"You are young, this relationship isn’t that old",girlfriend isn’t career oriented but I’m a hardworking man. Expects me to buy her things when clearly I can’t afford it.
49,Because I love her so much,"You are young, this relationship isn’t that old"
50,Dump her? Sounds like you two don't align on this pretty big issue and it doesn't seem like it's going to change at any point in time,Girlfriend isn’t career oriented but I’m a hardworking man.
51,I really want to cut ties with her,Dump her? Sounds like you two don't align on this pretty big issue and it doesn't seem like it's going to change at any point in time
52,Talk to him about it - tell him he set up an expectation prior to his new expectation and come to an agreement together of what you guys should do,my foreign bf wants me to propose to him to be ‘different’
53,"That’s good advice,  thank you",Talk to him about it - tell him he set up an expectation prior to his new expectation and come to an agreement together of what you guys should do
54,Sounds like he doesn’t want to get married,"My  boyfriend  decided he wants me to propose to him , after telling me he was going to propose to me…?"
55,"Um, no",Sounds like he doesn’t want to get married
56,30 is not old,getting older is taking a toll on me. How do I feel less alone?
57,I like to read and write,30 is not old
58,"Hey, another 30F here and I can very much relate",How can I  stop feeling alone and old at age 30?
60,Doesn’t sound like there is a future,. In love with a friend and wondering if the situation is worth pursuing
61,"I think she's willing to leave, she's just continuing her education in her home country",Doesn’t sound like there is a future
62,"Different country, obviously different culture, so different language? Maybe your hints aren't being comprehended in the way you assume they are",im  in love with a woman  who loves on the other side of the world in a country where gay marriage is illegal
63,Yes she knows,"Different country, obviously different culture, so different language? Maybe your hints aren't being comprehended in the way you assume they are"
64,You got together when you were children and now you're growing into adults,"bf of 5 yrs has been ignoring me & not giving me attention, feeling alone in our relationship, not sure how to approach him/ what to say"
66,"Have you spoken to him about how you're feeling and how his lack of interest is affecting you?

I think you guys need to sit down and talk about where this relationship is at and what you can do to keep the fire going",Burnt Out & Lonely in Longterm Relationship
67,I have at times but not at length,"Have you spoken to him about how you're feeling and how his lack of interest is affecting you?

I think you guys need to sit down and talk about where this relationship is at and what you can do to keep the fire going"
68,Your daughter is 5 and it sounds like she's acting developmentally normally,my daughter and my fiance don't like each other very much
70,"It seems like you’re blaming both of them, but one is five and one is a fully grown adult",My  daughter  and fiance  hate each other. I seriously don't have any clue how to deal with this.
71,I didn't mean to come across as blaming my daughter,"It seems like you’re blaming both of them, but one is five and one is a fully grown adult"
72,"Tell your girlfriend no, because it's not her place to ask that you stop showing platonic, physical affection for people you care about",girlfriend wants me to stop hugging my longtime friend (or anyone besides her or family) what’s the best way to approach this?
74,Have you asked her why it's suddenly a problem after you've been together for a year? I feel like there's some information missing from your story,My  girlfriend  wants me to stop hugging my longtime friend.
76,>Fast forward to now,Coworker is compulsive liar who makes jabs at me every chance she gets. She also makes jabs at my best friend there and then pretends like we’re all besties. How do I handle this?
78,"OP, it's clear that she isn't your friend so take distance from her",Coworker makes subtle jabs at me all the time
80,Bring her a gift like chocolate covered espresso beans to the party,shoudl i write her and ask again or not?
81,her exams are over now :/ but good idea,Bring her a gift like chocolate covered espresso beans to the party
82,Just be honest,Should i write her after the 3. Date?
84,I'm very sorry to hear how bad you're feeling,my relationship with my parents is broken and they feel like I’ve got nothing going for me.
86,"You need to do at least 2 things, and one of them is going to be really really hard: 1) you need to accept that you've had a shitty hand dealt to you and that's the way it is and 2) you need to plan for a future and understand that you can make your life what you want it to be",My  parents make me feel like I’m worthless sometimes
88,Why on earth do you think you are not supposed to tell your boyfriend how you feel? Telling your partner how you feel is a basic thing in relationships,My boyfriend wants me to care about him less and I don't know what to do.
90,"You are so young and I promise you will find someone who wants to hear all about your day, doesn't find you annoying, and cares just as much about you as you do about them",My boyfriend wants me to care about him less
92,Have you directly addressed this with them?,"partner is uncomfortable recieving/expressing physical interest or desire when we're apart, and it's starting to get to me but i can't tell if i'm just being needy about this."
93,"I brought up their discomfort with receiving these expressions, which they said they hadn't noticed/realized and would try to work on but little has changed",Have you directly addressed this with them?
96,Sounds like your dad is in some sort or crisis or turning point,"My father is extremely distant now, has his headphones in so he doesn't talk to anyone. He didn't come down for family dinner because of his video games. He doesn't feel like my dad but a roommate, already talked to him about it but he ignores it."
97,I've thought about this a lot,Sounds like your dad is in some sort or crisis or turning point
98,Is he still taking a lot of pain meds from his back surgeries?,My  Dad  is becoming distant and I don't know what to do about it.
99,"I'm not sure, but I would assume so since he has my mom pick up prescriptions for him all the time",Is he still taking a lot of pain meds from his back surgeries?
100,Just tell him,boyfriend and I are 22 and been together a year and a half
101,It’s less cool when there’s a potential for nerve damage which could permanently disfigure or paralyse me,Just tell him
102,"Could you go with a third option, one where you are very honest with him?


""Hey, I need to talk to you about something important",Is it bad to not tell my boyfriend about upcoming surgery?
103,"That’s pretty good ngl, might plagiarise some of that","Could you go with a third option, one where you are very honest with him?


""Hey, I need to talk to you about something important"
104,>He is very supportive and encouraging,"My (24F) boyfriend (23M) is great but rarely seems excited over my accomplishments. He is normally supportive and complementary but when I tell him of achievements I'm excited about, his reaction is often sub-par. What should I do?"
105,"Maybe, although he generally scores higher than me",>He is very supportive and encouraging
106,">What should I do?

He's jealous",My boyfriend doesn't seem excited for my accomplishments
108,My advice: don't date anyone,I’m wondering if anyone else has also struggled after a toxic relationship and how they recovered from it. Any tips would be greatly appreciated!!
110,"You should focus more on yourself, go to theraphy, pick up a sport or a new hobby, focus on your studies, your wants and your needs ONLY, at least for a while, people who got out of abusive relationships tend to repeat the same patterns if they are not aware of them and it can lead them once again to be in another toxic relationship, im not saying your current bf is abusive or will abuse you but you should definitely be aware of the circle of abuse, learn to stand up for yourself and create healthy boundaries or your are bound to repeat the same mistakes over and over again",Recovering from a toxic relationship
112,"How long have you guys been together? Have you had any major changes recently, like moving in together? Could it be a case that he feels able to be more vulnerable with you right now than before? I used to use the gym as an escape when I had nowhere else to go to feel like shit",Boyfriend has been stressed and not eating as much and stopped working out. Is there anything I can do to help and encourage him without being offensive?
114,"Well if he stoped going to the gym he might have made a concious choice to eat less, because he doesnt burn as much callories anymore",My  boyfriend  has stopped going to the gym and eating as much. How do I help?
116,"What do you gain by ""confronting"" him after he leaves the unit? Really? 'Cause you know that message won't be sufficient and there is sure as hell nothing constructive to come from it","I want to cut off my roommate after he leaves for the military because I feel like he's not someone who I should be around. How should I do that, or is it even a good idea to begin with?"
118,You’re right in wanting to cut him off,I  want to cut off my roommate  after he leaves for the military. What should I do and how should I do that?
120,I feel like some more info would be helpful in this situation,! In-laws don't communicate with me and are not friendly but they are staying with us for 7 months. I want them to leave but I have a flaw in that I don't like confrontation. Any advice with how to approach this.
122,"\--Why are they staying for seven months, and did your husband ask your permission for this? I really like my in laws and I would absolutely not want them to stay for longer than a weekend",My  in-laws  don't seem to like me but they are staying with us for 7 months
124,Discuss with her what she thinks will be the best way for her to regain some perspective on all of the other things that are important to her in her life,She thinks our relationship is responsible for her getting away from her family and studies. What should I do?
125,She asked me if we could talk less,Discuss with her what she thinks will be the best way for her to regain some perspective on all of the other things that are important to her in her life
128,"Whether or not you want to pause dating to work on yourself is completely up to you! I promise you that most people have to go on many, many dates to find someone they have a genuine connection with",Feel a bit hollow after having another unsuccessful date. Should I just sort my issues out and then come out swing with a bit more confidence? I feel a bit lost at this point.
130,"If dating isn't pleasant at the moment, take a pause",Should I [27M] just wait to start dating again until I sort myself out?
132,"Your husband is showing all indications that he doesn’t want to even talk to this woman, let alone cheat with her",- I know someone from my husbands past who I feel threatened by. They have done things sexually (her eating his ass/etc) I’m not comfortable with and I get in my head thinking about trying it that I won’t be doing it right or it won’t be good enough. TIPS on how to work through this? How to feel secure enough?
134,Honestly just think you need a new man,Letting go
136,It sounds like both of you are addressing this in a mature manner that will only help both of you in the long run,"-  male (53) and female (46) couple planning divorce. He examines the situation through soul-searching, sanity-checking exercise and hopes to input from fellow redditors who are going or have been through similar situation."
138,"If the plan is to divorce, then don’t add the complications of a property owned in another country",My wife [46] and I [53] have been planning to divorce and rebuild our lives with new partners.
152,"""Thanks for your opinion",- a friend is often patronising about music taste and personal preferences. Need comebacks to make them reflect on how silly it is in a non-malicious and preferably humorous way.
156,Please tell me this is a joke,"Mum showing no care for expensive iPad, unsure how to confront."
157,It's true unfortunately,Please tell me this is a joke
160,"Oh, hell no, you aren't responsible for his vehicle expenses",Am I in the wrong for not helping pay for my boyfriends expensive van project when I can’t afford it and we arnt married/bond together for life? I am just very realistic and think about if we don’t work out romantically (which there is a possibility of).
164,How did this go from self centered in-laws to a selfish SO? I think your SO is easily manipulated by his family because this is a very common thing to see when in laws are abusive,Looking for advice on how to deal with selfish SO.
165,Did you read this? He isn’t the selfish one here,How did this go from self centered in-laws to a selfish SO? I think your SO is easily manipulated by his family because this is a very common thing to see when in laws are abusive
168,">  if she did that, she wouldn't be able to stay with me, and most of all she would probably only get to see me like 3 days out of the two weeks she's staying out here","- i need some kind advice or coping mechanism that anyone can possibly give me to deal with this stress that i'm going through. for her too, because she really doesn't want her mom to ruin this whole plan we've been working on since last august. we're both stressed and annoyed at her mom. let me also add, her mother isn't the greatest and still treats her like she isn't able to do anything. her dad went against her mom and told her she's an adult and can do what she wants. i just seriously need some kind of assurance or advice, just something."
169,"you might be right, there",">  if she did that, she wouldn't be able to stay with me, and most of all she would probably only get to see me like 3 days out of the two weeks she's staying out here"
172,"Hey, you shouldn't agree to kids if you're not ready - especially if you're the one who's going to be supporting you gf and baby","My (27F) girlfriend (27F) of 8 years is pressuring me about having kids, already started the process and I'm not sure I'm onboard with it, really scared of losing her."
174,"If you're not ready, you're not ready",My  girlfriend  pressuring about having kids
175,"Him probably doing a big mistake? (If you don't want kids or know you aren't ready, don't let yourself get cornered into it)","If you're not ready, you're not ready"
176,"""I have been an AH in the past and I continue to be an AH"" is what this should have said",I have been an AH and cheating on my wife.
177,The only problem: the divorce conversations head nowhere,"""I have been an AH in the past and I continue to be an AH"" is what this should have said"
178,I guess stating your marriage has broken down due to irreconcilable differences is stating the obvious,Not fully screwed up but almost there
179,I and co-worker are looking out for opportunities,I guess stating your marriage has broken down due to irreconcilable differences is stating the obvious
180,It sounds like you aren't really compatible right now if there isn't a compromise,Partner breaking up due to my situation of being unable to meet him due to my mother.
182,"If you can get mental health care, you should",My boyfriend [20M] and I [19F] having serious relationship issues due to my mother [42F] who doesn't know about our relationship
184,It seems like you don’t trust him and probably shouldn’t,my (25f) boyfriend (26m) lied to me about his flight information when nothing ever changed. How do I approach this?
186,"He doesn't seem ready to be in a stable, healthy relationship",How should I  broach this lie with my  boyfriend?
188,No consequences = will continue the behavior,: my girlfriend lies a lot and always says it's because she doesn't recall it.
190,"If you've forgiven her in the past for it and she's continued to do it, what makes her saying she'll change this time different?","My girlfriend lies a lot, will she ever change?"
192,"Really, there's nothing *you* need to do",- One of my close guy friends is in love with me but i’m currently not interested in him nor do i think i’m fit for any relationship. We took a long break from each other but his feelings are still strong for me. We then tried to suppress any info on our feelings but he says it eats at him. Help.
196,Take the time to get over it,- Do I tell my friend about my crush on them or do I just take the time to get over it?
200,Your girlfriend lies to you a lot dude,my gf keeps seeing an ex on regular basis and I don't trust it
202,Grow some back bone,My  girlfriend  keeps former lovers as friends
204,You can suggest he seek out a therapist or psychologist,"My boyfriends mental health issues have caused him to become stuck, I don’t know how to help him without pushing him away for good. I’m looking for advice from people who have been in my shoes, or his, I can’t leave someone I love in a state like this."
206,"You don't necessarily have to jump to walking away, but you do have to set boundaries and you cannot enable his unhealthy mindset",We’re going through a rough patch
208,First,"Knocked up a girl from a one night stand, she’s now pregnant and I’m nervous/excited. Worried if it doesn’t work I won’t find love."
210,I am a 38f and I cannot have kids of my own,I  knocked up a  and i have a lot of feelings
212,"how about this whispering into your ear ""what if you were the gf instead in the situation instead? Then he leaves you after a month and started instantly messaging another girl that he truly wanted to be with the entire time"" 

dont be too obsesssed that you start disregarding his actions to his gf, as it can easily be you in that position as well",how do I stop having a toxic mindset and feels flattered by the attention of an unavailable man?
214,Block him and don't meet up with him,Is it normal that I  feel flattered that he would jeopardize his  relationship for me?
215,You’re right,Block him and don't meet up with him
216,">if a good guy came around and took me on great dates and romantic dinner, I would block the gym guy in a heartbeat","- So going back to gym guy, I'm not sure what to do. Do I keep him around or block him?"
218,"If you're happy with just sex (when hes asking for it, ignoring you're requests), then that's up to you if you want to continue until your tire of him or find another",I'm not sure if I  should keep around a guy  who's only good for sex
224,"Do you love him? If you feel like money is priority next to love, leave him asap","- boyfriend has money problems, both aren’t earning. Should I leave or stay."
226,"You're not happy in the relationship, are struggling to see a future with him, and don't feel you're being treated with respect","Boy friend has money issues, should I stay or leave?"
232,"""he says these aren’t even road rage and I only get scared because I was in car accidents"" -- that's uncalled for, rude, and insensitive",I don’t know if I (28f) should dump my (29m) bf he jokingly makes fun of me theres some examples above please read and also he gets road rage sometimes which he says “isn’t even road rage”
