,response,context
630,"Tell her *once* ""Mom, we'll get married once we are good and ready, and when we get engaged you'll be the first to know, but until then I *need* you to stop pressuring me",My mum gave me a deadline to get married
632,I think giving her space until she’s ready to talk is the right call here,"So in summary, my girlfriend is going through something, but she doesn’t want to talk about it to me. I don’t know if it’s regarding the relationship or not (I think so). And because of the situation, she doesn’t want to see me irl."
633,Yeah that’s what I’m gonna do,I think giving her space until she’s ready to talk is the right call here
634,I would let her know you will be there for her when she feels comfortable sharing,Girlfriend says she needs to figure her shit out.
635,Great,I would let her know you will be there for her when she feels comfortable sharing
636,"If you're in touch regularly, it should come up in conversation naturally","have a new man, how do I break the news to my ex?"
638,If he calls and texts you regularly he’s holding onto to the hope you will change your mind about being with him so do him a favour and just tell him you are in a new relationship,How do I break the news to my ex that I’m seeing someone new?
644,You brought it up,"Husband changed his mind to cover a tattoo of an ex baby mama after I agreed to cover some of my late husband, saying he was “just fucking with me.” The cover-ups were his idea to begin with."
645,Did you read the post? I was referring to some of the tattoos he had elsewhere - like the ones on his hands,You brought it up
646,I have never thought it was a good idea to get names tattooed on the body,My  husband  changed his mind
647,A lot of tattoo artists have rules about name tattoos simply because the number of people with acrimonious exes' names tattooed on their flesh for all time is too damn high,I have never thought it was a good idea to get names tattooed on the body
648,If you are unhappy and you can change it there is no reason to stay unhappy,"\*\* Bf cheated emotionally a couple of years ago (sent dirty messages and pictures to another guy). We're semi-long distance and I don't know when we can meet again. I have a strong desire to break up right now, but don't know if I should wait until we meet (which could be a long time from now) to do it in person."
649,"Would that not make me a very shitty person, though, given we've been together so long? Even though he did that, part of me feels like he deserves to say what he thinks/ask questions etc face to face",If you are unhappy and you can change it there is no reason to stay unhappy
650,I once had a semi-long distance relationship falter,"Me [29M] with my bf [28M] of four years, would it be acceptable to break up over the phone given our circumstances?"
651,"Thank you for sharing your story, it sounds like you're both in a better place now",I once had a semi-long distance relationship falter
652,"Dude it’s near impossible to be friends as exes, not even divorcees can do it for the kids","my ex wanted to just be friends, and she invited me to hang with her and her friends, but she ended up just ignoring me. Trying to make sense of this as best as I can."
654,"Maybe she regretted it and realized that you guys can’t be friends because you still have feelings and she doesn’t, but wasn’t going to kick you out or whatever","Ex invited me to hang with her and her friends, felt alienated"
655,"It's just more confusing given the fact that she's very blunt (I am too, but maybe slightly less than her) and doesn't sugarcoat things","Maybe she regretted it and realized that you guys can’t be friends because you still have feelings and she doesn’t, but wasn’t going to kick you out or whatever"
656,Talk to her,": turbo relationship, girl got afraid, I want to know how long to wait before I ask her if she wants to try again"
657,"Yeah , I want to do just that

I just don't know when would be a good time ask her to talk about it",Talk to her
658,Why can’t you two just talk things out and set some boundaries for the relationship moving forward so you can take things slower? It doesn’t have to be  complicated,"We amicably broke up because we were moving too fast, I want to try again, how long should I wait before I ask her."
659,"I agree

I just wanna know when should I ask her if she can talk about it",Why can’t you two just talk things out and set some boundaries for the relationship moving forward so you can take things slower? It doesn’t have to be  complicated
660,You date people to find out what kind of person they are,girlfriend blames me for everything
662,Blame shifting is the hallmark of a weak and immature person,My  Girlfriend  blames me when anything goes wrong
664,Change “ex” to “date” if you want to be taken seriously,gf won’t tell me someone’s name she went on a date with and I find that strange
666,I don’t consider this individual to be your girlfriends ex,Gf  won’t tell me exs name
667,You are correct about the ex thing,I don’t consider this individual to be your girlfriends ex
668,"I would almost be sure that any woman you, me, or anyone has or will ever be with has been with someone bigger",my girlfriend accidentally made me feel insecure about my penis and I don’t know what to do about it.
670,"First of all, congrats on the orgasm",My girlfriend  of six months accidentally made me  feel very insecure about myself and I’m really not sure how to move forward.
672,"I mean, your response isn't totally unreasonable, if you do it in a non-vindictive way","! My boyfriend thinks I’m lazy because I sleep in, procrastinate, and stay home a lot. I think I do way more than he comprehends (part time job + study + chores). Is there a mature way to resolve this?"
676,You break up because of a fundamental incompatibility,my boyfriend really hates being touched and touching me. What should I do?
678,You can't go into a relationship expecting to be able to change the other person,My boyfriend hates being touched. Does anyone have any advice ?
680,She’s not your girlfriend anymore,my sister's ex called my sis to tell her about screwing my ex and I feel sick to my guts
682,"Get therapy man and start working out and after you get over this, start dating again",MyM ex gf F hooked up with my sister's ex/my friend M
683,"Rn I am working full time and work out, it has been great and I thought (fool me) that being friends with your ex is aight","Get therapy man and start working out and after you get over this, start dating again"
684,"""I have good news"" for you mate","I just got out of a relationship where I took things super fast, and now I have met a new girl where we both want to take things slowly. What things can I do to help make sure that we are taking it slow?"
692,How did you find out about this? Are you 100% sure it’s true?,My girlfriend lied about her past relationships. I am not upset about her past relationships just sad she hasn't been honest with me and now i have trust issues and question if she has lied to me about other things. Should i approach her about it or just let it be?
693,"Her Facebook wasn't working and she gave me her password to she what went wrong, looked through the old conversation after Facebook started working",How did you find out about this? Are you 100% sure it’s true?
694,"Despite it being the past, if you think it will continue to bother you then bring it up and talk about it","My girlfriend lied to me about one of her ex relationship, should I approach her about it or just let it be?"
695,"The past doesn't bother me dude, it just that she made a whole story and lied to me","Despite it being the past, if you think it will continue to bother you then bring it up and talk about it"
696,"Someone that pushes you away to ""punish"" you isn't worth keeping","bf distanced from me a week as ‘a punishment’ for a missunderstanding. I tried so much to fix it. After do many efforts he is nice to me again. But I feel I need to constantly be the one who tries. He gets clueless, frustrated and silent pretty fast. He just blames his lack of experience."
697,Indeed,"Someone that pushes you away to ""punish"" you isn't worth keeping"
698,"This sounds like a very exhausting, unhealthy relationship",I [late 20’s F] feel I can’t be closer to him after what he did
700,there's not much you or your SO can do,how to navigate and support my partner who's mom sick and dad exhausted
701,Thank you for your words,there's not much you or your SO can do
704,">	I always thought that women don’t have to put much effort into dating, hence what I’ve seen from other women’s experiences",Unrealistic or just haven’t met the right one?
706,"OP, there isn’t anything in here about the type of qualities you’re looking for beyond the external, and that’s a little concerning, especially when you say that you ditched someone because of his looks",Am I unrealistic about relationships?
708,This is just a hot mess,- my friends advice me to break up but I love him so much. I know he flirts with other girls. I was trying to be okay with it. But right now I don't know wat to do.
710,He baits you into being possessive,I feel like My bf is cheating on me
711,Had an ex that did this,He baits you into being possessive
712,Sending many hugs,emotionally scarred from past relationships/ finding it so hard to heal. I need someone I can talk to
713,Coming now!,Sending many hugs
714,"Do you have deep conversations with people before you get too deep with them?

Before I dated anyone I'd want to know what their views on men and women were, whether they were together in terms of money, being clean, being emotionally stable",Im finding it so hard to heal F21
716,Take a deep breath,feeling inadequate after connected the dots and found out that my gf is a grand daughter of a very important person
718,She didn't choose who her grandparents are any more than you did,Feeling inadequate and confused on what should I do?
720,When you are in her parents house you respect their rules,"Girlfriend's parents don't allow me to have a drink around them, girlfriend supports her parents even though she drinks too."
721,Yeah I have a good sense of that,When you are in her parents house you respect their rules
722,You're completely right and it's your right as an adult to drink,My future fiance's family is anti-alcohol.
723,"Thank you for the input! Since it usually causes a brief argument whenever it's been brought up, I've mostly been avoiding it and just sucking it up",You're completely right and it's your right as an adult to drink
724,I think maybe it’s more of an acceptance thing,My partner has way more friends than me and really likes to go out and have fun. I’m worried my reaction to this difference is going to have an adverse affect on our relationship because of behaviours that may arise from feeling less than / unworthy.
725,It’s so odd though,I think maybe it’s more of an acceptance thing
726,My late wife was very similar,I  struggle to integrate into my partners  friend group.
727,Thanks for sharing that,My late wife was very similar
728,"I think anytime a partner says ""Ya know it's fine if we break up"" it's a huge red flag, regardless of however they rationalize/explain it",": at different crossroads in our relationship and I am thinking of ending the relationship, so is what i am doing the right option? Also how do you come to term on ending a relationship if it wasn’t rooted in anything negative?"
729,If i think ending the relationship is what i should do,"I think anytime a partner says ""Ya know it's fine if we break up"" it's a huge red flag, regardless of however they rationalize/explain it"
730,"Loving someone is easy! It’s the rest that’s hard: being compatible, at the same stage of life and with similar goals and all that",Am I doing the right thing?
732,"Hey, similar age and also DINKS by choice","My wife and I are getting to an age where it's just getting so hard to make and keep friends.  This week has been really demoralizing with people having blown us off, and I can't help but feel like even trying to make anything happen with anyone is just virtually impossible at this age.  What can be done?"
733,These are all really solid strategies,"Hey, similar age and also DINKS by choice"
734,"I don't have any great advice, but this does remind me of a wonderful tweet that I saw","I'm  so exhausted of it being impossible to make or keep friends at this age, and I'm kind of depressed about how many have let me down. What can even be done?"
736,Sorry,I'm having a hard time getting over an ex and need advice or stories to help.
738,Time + distance,How do I get over my ex?
739,Honestly I do occasionally keep tabs on what she posts online and recently it's been all about her hook ups with other people and it just shoots my anxiety through the roof,Time + distance
740,Your relationship is toxic AF,My girlfriend made rules for what i can and can’t do but broke them and she can’t control her emotions and breaks down a lot about me doing things with other people especially when weed and alcohol are involved and she wants me to be around her all the time and she keeps shouting at me over things i can’t control and i feel like i need to live my life to please her to avoid hurting her or having her break down and hurt herself physically over me. So i’ve ended up hiding hanging out with friends and i feel distant from my family and isolated from everyone else.
742,"For the future: Don't *ever* date someone who thinks they have the authority to make ""rules"" for you",My  girlfriend  made rules for me and i feel like i can’t see friends and im isolated from my family but it’s my own fault
744,The first crush is intense,not able to forget a crush. How do I do it?
745,"Gawd,this is what I was worried about",The first crush is intense
746,i remember but being 30 now it was all so childish to me looking back to a relationship from when i was 16-17,Do we ever forget our first crush?
747,The thing is it never amounted to a relationship,i remember but being 30 now it was all so childish to me looking back to a relationship from when i was 16-17
748,You can't help an addict unless they want help,Friend drove my car to a liquor store and drank for 2 hours while I covered for him at our job. He then drove his drunk ass back to work. I saw the whole thing on my car's camera.
750,"Lady, you need to take a serious step back  from that friendship",My friend is an alcoholic and I dont know how to help him.
751,Don't think for a second that I am not considering your advice by asking this question --- How do I step back without him feeling like I've abandoned him? We have been friends for years,"Lady, you need to take a serious step back  from that friendship"
760,"As a general rule, you should never be especially concerned over the behavior of someone you’re *not* in a relationship with","an online friend messages my partner constantly, compliments their appearance, and frequently says they miss them - is this inappropriate?"
761,It's always struck me as strange when people say they trust their partner,"As a general rule, you should never be especially concerned over the behavior of someone you’re *not* in a relationship with"
762,>For my partner it is just a platonic online friend,Should I be concerned over my partner's online friend's behaviour?
763,"Thanks for the response, I appreciate it",>For my partner it is just a platonic online friend
764,First thought is too much jerking either now or historically,"My boyfriend has issues finishing, no matter how long we have done it. However has no issue with jerking off (not a porn issue)."
766,"If you're long distance and just saw each other for a brief period of time, it's possible there's a bit of anxiety/pressure to perform",My bf  has trouble finishing
768,"Figure out how you can afford to move out, whether that's getting help from family members, asking for a raise/getting another job, anything",my relationship is basically nonexistent. Bf is useless unromantic unchangeable. I need advice
770,Get away from him,Nonexistent relationship help
772,If you're in school you should be able to access a counselor on campus or through zoom,The relationship doesnt feel right and im not sure wheter its my anxiety talking or im just dumb and need to leave
774,"It would be a mistake to dump your partner to spare his feelings, as it would ignore his feelings in the first place",the relationship doesnt feel right anymore (m18
775,Thank you for that :( i really appreciate hearing all that,"It would be a mistake to dump your partner to spare his feelings, as it would ignore his feelings in the first place"
780,"Sorry but a break at 30 years old is just Breakup Lite™️ because someone doesn’t want to be the bad guy, or the logistics of a breakup are too daunting or whatever","me and fiance started a break and she instantly has been super horny and masturbating all day, I think it's screams suspicious, what do you guys think?"
781,"Yeah I agree, I even said this is mostly likely the beginning of the end for us","Sorry but a break at 30 years old is just Breakup Lite™️ because someone doesn’t want to be the bad guy, or the logistics of a breakup are too daunting or whatever"
782,going onto or off the Pill is 100% a well known cause of a major change in libido,Me  and my fiance  have just gone a 2 month break today and everything has changed.
